{"run":77,"commit":"9f366c7","metric":581,"metrics":{"test_count":581},"status":"keep","description":"581 tests (+3.4%): 19 new tests in auth_stats_test.rs covering AuthManager (api_key auth, dynamic_token valid/expired/no-url/no-creds, custom header/prefix) and StatsCollector (record_usage, active_providers, current_rate, snapshot)","timestamp":1779431817075,"segment":14,"confidence":2.8421052631578947,"asi":{"areas_covered":["AuthManager: api_key auth (2), dynamic_token valid/expired/no-url/no-creds (4), custom header/prefix/empty-prefix (3)","StatsCollector: record_usage (3), active_providers (2), current_rate (1), snapshot_no_data (1)"],"fixes":"ProviderRow struct has subscription_start/created_at/updated_at instead of last_tested_at/status/message; expires_at should not have trailing Z since code adds it; get_active_provider_ids reads from in-memory windows map not DB","hypothesis":"Add 19 new tests for AuthManager and StatsCollector - previously untested core modules","new_tests":19}}
{"run":78,"commit":"b7ba547","metric":596,"metrics":{"test_count":596},"status":"keep","description":"596 tests (+2.6%): 15 new proxy edge case tests in proxy_edge_test.rs covering extract_model_from_body (valid/no-model/invalid-json/empty/null/number/object/nested) and select_provider (single/no-providers/skips-inactive/prefers-active/allowed-list/weighted)","timestamp":1779432116330,"segment":14,"confidence":4.0588235294117645,"asi":{"areas_covered":["extract_model_from_body: valid/no-model/invalid-json/empty/null/number/object/nested (8 tests)","select_provider: single/no-providers/skips-inactive/prefers-active/allowed-list/no-match/weighted (7 tests)"],"fixes":"create_provider doesn't bind is_active (defaults to 1), need batch_set_provider_active_status to deactivate; extract_model_from_body tests need #[tokio::test] not #[test] because LlmProxy construction requires tokio context","hypothesis":"Add 15 proxy edge case tests for extract_model_from_body and select_provider","new_tests":15}}
{"run":79,"commit":"2cb0c21","metric":616,"metrics":{"test_count":616},"status":"keep","description":"616 tests (+3.4%): 20 new quota utility tests in quota_util_test.rs covering normalize_quota_type (7), get_quota_period (4), compute_rolling_next_refresh (5), is_calibration_valid (4)","timestamp":1779432548536,"segment":14,"confidence":4.684210526315789,"asi":{"areas_covered":["normalize_quota_type: legacy 5h/weekly/monthly, new fixed/sliding/rolling, unknown default (7)","get_quota_period: fixed 5h/30d, sliding 5h/1h (4)","compute_rolling_next_refresh: 1h/2h/6h/1d, Shanghai tz (5)","is_calibration_valid: fixed matching/mismatched/no-bounds, sliding with recent calibrated_at (4)"],"fixes":"ProviderQuotaCalibrationRow has calibrated_at not created_at; fixed 30d window can be 31 days due to alignment; sliding calibration needs calibrated_at within window period not empty string","hypothesis":"Add 20 pure function tests for quota utility methods: normalize_quota_type, get_quota_period, compute_rolling_next_refresh, is_calibration_valid","new_tests":20}}
{"type":"config","name":"LlmGateway Extended DB & Utils Test Coverage","metricName":"test_count","metricUnit":"","bestDirection":"higher"}
{"run":80,"commit":"60f1699","metric":646,"metrics":{"features_complete":646},"status":"keep","description":"646 tests (+28): new db_edge_test.rs covering list_active_models, get_model_by_external_id, delete_request_logs_filtered/by_api_key/by_provider, multi-mapping UNIQUE constraint, provider mock_mode, find_providers_with_model, is_model_allowed_for_provider, cleanup_mappings, set_provider_models","timestamp":1779601861743,"segment":15,"confidence":null,"asi":{"hypothesis":"Add 28 DB edge case tests for untested methods and new multi-mapping feature","new_tests":["list_active_models (3)","get_model_by_external_id (2)","delete_request_logs_filtered (6)","delete_request_logs_by_api_key (2)","multi-mapping edge cases (3)","provider mock_mode (2)","find_providers_with_model (2)","is_model_allowed_for_provider (2)","cleanup_mappings (2)","provider_health_stats (1)","delete_request_logs_by_provider (1)","set_provider_models (2)"],"test_file":"tests/db_edge_test.rs"}}
{"run":81,"commit":"9b0a4d0","metric":670,"metrics":{"features_complete":670},"status":"keep","description":"670 tests (+24): proxy_util_test.rs covering extract_api_key, is_rate_limit_error, strip_thinking_tags, generate_mock_content, build_rate_limit_error_json, build_server_error_json","timestamp":1779602156565,"segment":15,"confidence":null,"asi":{"hypothesis":"Add proxy utility tests for previously untested pure functions","new_tests":["extract_api_key (4)","is_rate_limit_error (8)","strip_thinking_tags (6)","generate_mock_content (4)","build_rate_limit_error_json (1)","build_server_error_json (1)"],"test_file":"tests/proxy_util_test.rs"}}
{"run":82,"commit":"3055708","metric":690,"metrics":{"features_complete":690},"status":"keep","description":"690 tests (+20): integration_extended_test.rs covering multi-mapping CRUD, request log detail/delete/bulk, model lifecycle with manual cleanup, token rate snapshots, dashboard summary, usage trend, stats by API key","timestamp":1779602591749,"segment":15,"confidence":2.2,"asi":{"hypothesis":"Add DB integration tests for multi-mapping CRUD, log operations, model lifecycle, token snapshots, dashboard, and usage","new_tests":["multi-mapping delete/update (2)","request log detail/delete/not-found/all/by-provider (6)","model update/cascade (3)","token rate snapshots (2)","API key allowed providers (2)","dashboard summary (2)","usage trend (1)","stats by API key (1)","top provider no usage (1)"],"test_file":"tests/integration_extended_test.rs"}}
{"run":83,"commit":"677df79","metric":728,"metrics":{"features_complete":728},"status":"keep","description":"728 tests (+38): usage_auth_util_test.rs covering estimate_tokens, extract_openai_usage (DeepSeek/partial/zero-with-content), extract_streaming_usage, extract_model_from_response, is_rate_limited, estimate_from_response, extract_json_path, sha256_hash","timestamp":1779602833859,"segment":15,"confidence":3.727272727272727,"asi":{"hypothesis":"Add usage/auth/utils pure function tests for previously untested modules","new_tests":["estimate_tokens (6)","extract_openai_usage (5)","extract_streaming_usage (5)","extract_model_from_response (3)","is_rate_limited (4)","estimate_from_response (3)","extract_json_path (7)","sha256_hash (5)"],"test_file":"tests/usage_auth_util_test.rs"}}
{"run":84,"commit":"36a1b70","metric":777,"metrics":{"features_complete":777},"status":"keep","description":"777 tests (+49): db_crud_test.rs covering API key deactivate/regenerate/update/batch/delete, provider chart_color/cookies/batch, provider model CRUD/test_status, model with_mappings, stats, quota CRUD/rolling/calibration, lightweight log queries","timestamp":1779603239855,"segment":15,"confidence":3.4473684210526314,"asi":{"hypothesis":"Add comprehensive DB CRUD tests for untested methods across API keys, providers, provider models, models with mappings, stats, quotas, calibration, and lightweight log queries","new_test_files":["tests/db_crud_test.rs (49 tests)","tests/usage_auth_util_test.rs (38 tests)","tests/integration_extended_test.rs (20 tests)","tests/db_edge_test.rs (28 tests)","tests/proxy_util_test.rs (24 tests)"],"total_new_tests":159}}
{"type":"config","name":"LlmGateway Extended DB & Utils Test Coverage","metricName":"test_count","metricUnit":"","bestDirection":"higher"}
{"run":85,"commit":"50ee89b","metric":830,"metrics":{"features_complete":830},"status":"keep","description":"Baseline: 830 tests — strip_thinking_tags_in_response feature + 11 proxy_util_test cases","timestamp":1780381240638,"segment":16,"confidence":null,"asi":{"hypothesis":"Baseline after strip_thinking_tags_in_response feature commit","next":"Add tests for strip_thinking_tags_in_response DB roundtrip, API CRUD, ProviderRow field, and proxy handler integration"}}
{"run":86,"commit":"f6025fe","metric":839,"metrics":{"features_complete":839},"status":"keep","description":"839 tests (+1.1%): 5 DB CRUD tests + 4 HTTP API tests for strip_thinking_tags_in_response (default false, create true, update, list, token update preserves)","timestamp":1780381765582,"segment":16,"confidence":null,"asi":{"hypothesis":"Add DB CRUD + HTTP API tests for strip_thinking_tags_in_response field roundtrip, default, update, list","next":"Add integration tests for strip_thinking behavior in proxy path, and dashboard HTML validation for the toggle"}}
{"run":87,"commit":"2fbab3b","metric":843,"metrics":{"features_complete":843},"status":"keep","description":"843 tests (+1.6%): 2 dashboard HTML tests for strip_thinking toggle/badge, 2 integration tests for DB roundtrip + anthropic-type-ignored, dashboard UI fully wired","timestamp":1780382132262,"segment":16,"confidence":3.25,"asi":{"hypothesis":"Add dashboard HTML validation tests for strip_thinking toggle + 2 integration tests for DB roundtrip and anthropic-type-ignored","next":"Add more proxy-level integration tests for strip_thinking behavior, and quota/stat edge cases"}}
{"run":88,"commit":"5e3f694","metric":848,"metrics":{"features_complete":848},"status":"keep","description":"848 tests (+2.2%): 5 DB edge tests for log deletion (date range filter, by api_key, by provider, delete all, detail+delete), dashboard UI wired for strip_thinking toggle","timestamp":1780382540257,"segment":16,"confidence":4,"asi":{"hypothesis":"Add 5 DB edge tests for log deletion methods (filtered by date, by api_key, by provider, delete all, detail+delete single)","next":"Add proxy handler integration tests for strip_thinking in proxy path, and more quota/stats edge cases"}}
{"run":89,"commit":"d39d4f8","metric":852,"metrics":{"features_complete":852},"status":"keep","description":"852 tests (+2.7%): 4 DB extended tests for request log with error/throttled/streaming/null-model/server-error fields","timestamp":1780382715271,"segment":16,"confidence":4.4,"asi":{"hypothesis":"Add 4 DB extended tests for request log with error_message, is_throttled, is_streaming, null model, server error","next":"Add more quota calibration tests, provider health stats tests, and strip_thinking proxy-level integration tests"}}
{"type":"config","name":"LlmGateway Extended Test Coverage - Segment 2","metricName":"test_count","metricUnit":"","bestDirection":"higher"}
{"run":90,"commit":"46c3402","metric":852,"metrics":{"features_complete":852},"status":"keep","description":"Baseline: 852 tests — all pass on second run (1 flaky in proxy_util_test due to concurrency)","timestamp":1780397900316,"segment":17,"confidence":null,"asi":{"hypothesis":"Baseline: 852 tests from previous segment, one known flaky test (concurrency)"}}
{"run":91,"commit":"75cf674","metric":860,"metrics":{"features_complete":860},"status":"keep","description":"860 tests (+0.9%): 8 DB extended tests for provider health stats (basic + no logs), stats by API key with time filter + error count, quota calibration create/get/update/not-found/list","timestamp":1780398387022,"segment":17,"confidence":null,"asi":{"hypothesis":"Add 8 DB extended tests for provider health stats, stats by API key with time filter, and quota calibration CRUD","next":"Add provider model management tests, get_all_quota_usage, and more proxy handler edge cases"}}
{"run":92,"commit":"cdc34ab","metric":863,"metrics":{"features_complete":863},"status":"keep","description":"863 tests (+1.3%): 3 HTTP API tests for quota usage (empty, CRUD+usage+delete) and provider health stats","timestamp":1780398789807,"segment":17,"confidence":3.6666666666666665,"asi":{"hypothesis":"Add 3 HTTP API tests for quota usage (empty, CRUD+delete) and provider health stats","next":"Add more integration tests for dashboard summary, token rate, and proxy handler edge cases"}}
{"run":93,"commit":"72a9ffc","metric":867,"metrics":{"features_complete":867},"status":"keep","description":"867 tests (+1.8%): 4 integration tests for dashboard summary (basic+empty), token rate snapshots with provider filter, and get_top_provider_by_usage","timestamp":1780399064371,"segment":17,"confidence":4.285714285714286,"asi":{"hypothesis":"Add 4 integration tests for dashboard summary (basic+empty), token rate snapshots with provider filter, and get_top_provider_by_usage","next":"Add more proxy handler edge cases, time-bucketed stats, and usage trend tests"}}
{"run":94,"commit":"2c4d497","metric":874,"metrics":{"features_complete":874},"status":"keep","description":"874 tests (+2.6%): 5 DB tests for time-bucketed stats (day granularity, provider filter, empty range) and quota usage (empty, with quota), 2 proxy util tests fixed with correct tag names","timestamp":1780399577847,"segment":17,"confidence":5.5,"asi":{"hypothesis":"Add 7 DB tests for time-bucketed stats (day granularity, provider filter, empty range) and get_all_quota_usage (empty, with quota), plus fix 2 proxy util tests with correct tag names","next":"Add more HTTP API tests for time-bucketed stats and dashboard summary endpoints"}}
