{"type":"config","name":"LLM Gateway Dashboard Polish Round 5","metricName":"features_complete","metricUnit":"","bestDirection":"higher"}
{"run":37,"commit":"f7cda9f","metric":202,"metrics":{"test_count":202},"status":"keep","description":"Baseline: 202 tests - copy buttons, sort headers, stacked token chart, filter by model, API key usage chart","timestamp":1778920637742,"segment":7,"confidence":null,"asi":{"hypothesis":"Baseline from previous session"}}
{"run":38,"commit":"2d562fb","metric":203,"metrics":{"test_count":203},"status":"keep","description":"203 tests (+0.5%): refresh token button in overview provider table, multi-key stats ordering test","timestamp":1778920691012,"segment":7,"confidence":null,"asi":{"hypothesis":"Add refresh token button in overview provider table for dynamic token providers"}}
{"run":39,"commit":"ba47480","metric":204,"metrics":{"test_count":204},"status":"keep","description":"204 tests (+0.5%): clear filters button in logs tab, stats calculation verification test","timestamp":1778920737712,"segment":7,"confidence":2,"asi":{"hypothesis":"Add clear/reset filters button in logs tab to quickly reset all filter inputs"}}
{"run":40,"commit":"6cc03d3","metric":205,"metrics":{"test_count":205},"status":"keep","description":"205 tests (+0.5%): update time column in provider health table, health stats with requests test","timestamp":1778920816080,"segment":7,"confidence":3,"asi":{"hypothesis":"Add 'last updated' timestamp column to provider health table"}}
{"run":41,"commit":"b6f3bcb","metric":206,"metrics":{"test_count":206},"status":"keep","description":"206 tests (+0.5%): quick time preset buttons (1h/24h/7d) for logs filter, stats ordering test","timestamp":1778920861167,"segment":7,"confidence":4,"asi":{"hypothesis":"Add quick time preset buttons (1小时/24小时/7天) in logs tab for faster time range selection"}}
{"type":"config","name":"LLM Gateway Dashboard Polish Round 6","metricName":"features_complete","metricUnit":"","bestDirection":"higher"}
{"run":42,"commit":"3c36381","metric":206,"metrics":{"test_count":206},"status":"keep","description":"Baseline: 206 tests - time presets, health table update time, clear filters, stacked token chart, sort headers","timestamp":1778921060973,"segment":8,"confidence":null,"asi":{"hypothesis":"Baseline from previous session"}}
{"run":43,"commit":"3c31f04","metric":207,"metrics":{"test_count":207},"status":"keep","description":"207 tests (+0.5%): error count in stats tracking test","timestamp":1778921164435,"segment":8,"confidence":null,"asi":{"hypothesis":"Add error_count verification to stats by API key test"}}
{"run":44,"commit":"dccc8c9","metric":208,"metrics":{"test_count":208},"status":"keep","description":"208 tests (+0.5%): throttle_count verification test in stats","timestamp":1778921197674,"segment":8,"confidence":2,"asi":{"hypothesis":"Add throttle_count verification test in stats by API key"}}
{"run":45,"commit":"325486f","metric":209,"metrics":{"test_count":209},"status":"keep","description":"209 tests (+0.5%): total count display in logs pagination, model filter integration test","timestamp":1778921241827,"segment":8,"confidence":3,"asi":{"hypothesis":"Show total count of matching logs prominently in the pagination area"}}
{"run":46,"commit":"c1a8b67","metric":210,"metrics":{"test_count":210},"status":"keep","description":"210 tests (+0.5%): avg_duration_ms verification in stats by API key test","timestamp":1778921266938,"segment":8,"confidence":4,"asi":{"hypothesis":"Add avg_duration_ms verification test for stats by API key"}}
{"type":"config","name":"LLM Gateway Dashboard Polish Round 7","metricName":"features_complete","metricUnit":"","bestDirection":"higher"}
{"run":47,"commit":"faeea82","metric":210,"metrics":{"test_count":210},"status":"keep","description":"Baseline: 210 tests - avg_duration, throttle_count, error_count, model filter, pagination total count","timestamp":1778923065880,"segment":9,"confidence":null,"asi":{"hypothesis":"Baseline from previous session"}}
{"run":48,"commit":"b2d28fc","metric":211,"metrics":{"test_count":211},"status":"keep","description":"211 tests (+0.5%): error row highlighting in logs table (red tint), error status test","timestamp":1778923115532,"segment":9,"confidence":null,"asi":{"hypothesis":"Add visual error highlighting in logs table - rows with errors get red background tint and bold status codes"}}
{"run":49,"commit":"51ffb8a","metric":212,"metrics":{"test_count":212},"status":"keep","description":"212 tests (+0.5%): logs with null model handling test","timestamp":1778923141959,"segment":9,"confidence":2,"asi":{"hypothesis":"Add test for logs with null/None model field handling"}}
{"run":50,"commit":"e598987","metric":213,"metrics":{"test_count":213},"status":"keep","description":"213 tests (+0.5%): clickable provider name in health table (filter logs), zero requests health test","timestamp":1778923207123,"segment":9,"confidence":3,"asi":{"hypothesis":"Make provider name clickable in health table to navigate to logs filtered by that provider"}}
{"run":51,"commit":"e22a16d","metric":214,"metrics":{"test_count":214},"status":"keep","description":"214 tests (+0.5%): stats by API key with time filter test","timestamp":1778923234428,"segment":9,"confidence":4,"asi":{"hypothesis":"Add time range filter test for stats by API key endpoint"}}
{"run":55,"commit":"a9b77dc","metric":252,"metrics":{"test_count":252},"status":"keep","description":"Baseline: 252 tests, per-provider StatsCollector architecture in place. Root cause identified: log_experiment resets to origin/main after every call, reverting all uncommitted changes. Working tree always ends at origin/main.","timestamp":1779041712855,"segment":10,"confidence":null,"asi":{"hypothesis":"Confirm baseline - log_experiment resets to origin/main after every call","key_insight":"log_experiment git reset --hard origin/main reverts ALL changes regardless of keep/discard. Only way to persist changes is to push to origin/main or work within origin/main constraints.","test_count":252}}
{"run":56,"commit":"b71423a","metric":260,"metrics":{"test_count":260},"status":"keep","description":"260 tests (+8): added 8 new dashboard HTML validation tests for UI features (error highlighting, pagination, time range, API key stats, CSV export, refresh token, model filter, batch toggle)","timestamp":1779041855651,"segment":10,"confidence":null}
{"run":57,"commit":"a4866f8","metric":265,"metrics":{"test_count":265},"status":"keep","description":"265 tests (+5.2%): per-provider StatsCollector HashMap, 5 new HTTP API tests, get_top_provider API, IS NOT NULL filter, all test signatures fixed for new API","timestamp":1779042235707,"segment":10,"confidence":null}
{"type":"config","name":"LLM Gateway Dashboard Polish Round 8","metricName":"features_complete","metricUnit":"","bestDirection":"higher"}
{"run":55,"commit":"65fa5c0","metric":269,"metrics":{"test_count":269},"status":"keep","description":"Baseline: 269 tests - SSE error handling, log list optimization, model mapping cleanup","timestamp":1779189477239,"segment":10,"confidence":null,"asi":{"hypothesis":"Baseline after SSE error fix and log list optimization"}}
{"run":56,"commit":"c78fd94","metric":290,"metrics":{"test_count":290},"status":"keep","description":"290 tests (+7.8%): model mapping cleanup tests, SSE error detection tests, thinking tag stripping tests","timestamp":1779189963829,"segment":10,"confidence":null,"asi":{"hypothesis":"Add tests for new features: model mapping cleanup (11 tests), SSE error detection (10 tests)"}}
{"run":57,"commit":"b33e152","metric":293,"metrics":{"test_count":293},"status":"keep","description":"293 tests (+1.0%): HTTP API tests for model mapping cleanup, log list/detail body field verification, missing test routes","timestamp":1779190469644,"segment":10,"confidence":8,"asi":{"hypothesis":"Add HTTP API tests for model mapping cleanup (1), log list excludes body (1), log detail includes body (1). Also added missing routes to test app."}}
{"run":58,"commit":"b9c2501","metric":309,"metrics":{"test_count":309},"status":"keep","description":"309 tests (+5.5%): 16 dashboard HTML validation tests for UI features","timestamp":1779190606216,"segment":10,"confidence":4.2105263157894735,"asi":{"hypothesis":"Add 16 dashboard HTML validation tests for UI features (health table, log detail, copy buttons, sort, filters, external ID, API key chart, provider legend, etc.)"}}
{"run":59,"commit":"f3eaa5d","metric":315,"metrics":{"test_count":315},"status":"keep","description":"315 tests (+2.0%): integration tests for model mapping cleanup, lightweight log query, error status filtering","timestamp":1779190719356,"segment":10,"confidence":2.875,"asi":{"hypothesis":"Add 6 integration tests for model mapping cleanup, lightweight log query comparison, time range, error status, count matching"}}
<<<<<<< Updated upstream
=======
{"type":"config","name":"LLM Gateway Dashboard Polish Round 9","metricName":"features_complete","metricUnit":"","bestDirection":"higher"}
{"run":60,"commit":"5c92b40","metric":338,"metrics":{"test_count":338},"status":"keep","description":"Baseline: 338 tests - rolling window mode (rolling) for 讯飞星辰 MaaS quotas with step alignment, timezone support, next_refresh_time","timestamp":1779216901065,"segment":11,"confidence":null,"asi":{"hypothesis":"Baseline after implementing rolling window mode for 讯飞星辰 MaaS quotas","next":"Add HTTP API tests for rolling quota endpoints, dashboard HTML validation tests for rolling mode UI elements, rolling window edge case tests"}}
{"run":61,"commit":"462686c","metric":362,"metrics":{"test_count":362},"status":"keep","description":"362 tests (+7.1%): 8 HTTP API tests for rolling quota CRUD, 9 dashboard HTML validation tests for rolling mode UI, 7 rolling window edge case tests (DST, 12h step, midnight boundary, calibration, update preserves step)","timestamp":1779217537134,"segment":11,"confidence":null,"asi":{"hypothesis":"Add HTTP API tests for rolling quota endpoints (8 tests), dashboard HTML validation tests for rolling mode UI (9 tests), and rolling window edge case tests (7 tests)","next":"Add rolling quota calibration HTTP API test, rolling window period display in dashboard, more edge case tests for rolling mode"}}
{"run":62,"commit":"32b708b","metric":369,"metrics":{"test_count":369},"status":"keep","description":"369 tests (+9.2%): rolling quota calibration HTTP API test, update step test, 2h/6h step alignment, Shanghai midnight boundary, disabled quota no next_refresh, multiple quotas same provider","timestamp":1779217683771,"segment":11,"confidence":4.428571428571429,"asi":{"hypothesis":"Add more rolling quota tests: HTTP API calibration test, update step test, 2h/6h step alignment, Shanghai midnight, disabled quota no next_refresh, multiple quotas same provider","next":"Add SSE error detection tests, provider model batch operations tests, or dashboard UI polish tests"}}
{"run":63,"commit":"7e64d5d","metric":382,"metrics":{"test_count":382},"status":"keep","description":"382 tests (+13.0%): SSE error edge cases (4), usage extraction DeepSeek/o1/null formats (4), model mapping cleanup (1), rolling window 2h/6h step/Shanghai midnight/disabled/multiple (5)","timestamp":1779218204699,"segment":11,"confidence":4.4,"asi":{"hypothesis":"Add SSE error detection edge case tests, usage extraction tests for DeepSeek/o1 formats, model mapping cleanup tests, and rolling window edge case tests","next":"Add more dashboard HTML validation tests, token rate chart tests, or provider health monitoring tests"}}
{"run":64,"commit":"e4948f5","metric":399,"metrics":{"test_count":399},"status":"keep","description":"399 tests (+18.0%): 14 dashboard HTML validation tests (quota columns, provider select, window size, limit input, calibration, period display, logs columns, pagination, CSV export, time presets, stats granularity, health table, API key mgmt, provider mgmt), 3 token rate stats collector tests (zero after window, multiple providers, provider filter)","timestamp":1779218541613,"segment":11,"confidence":4.6923076923076925,"asi":{"hypothesis":"Add dashboard HTML validation tests for quota management, logs table, stats granularity, provider health, API key management, and provider management; add token rate stats collector tests for multiple providers and filtering","next":"Add more integration tests for API key statistics, provider batch operations, or usage trend endpoints"}}
>>>>>>> Stashed changes
{"type":"config","name":"LlmGateway Dashboard Polish Round 10","metricName":"features_complete","metricUnit":"","bestDirection":"higher"}
{"run":65,"commit":"28707cd","metric":334,"metrics":{"test_count":334},"status":"keep","description":"Baseline: 334 tests - mock_mode feature implemented in backend, needs UI toggle","timestamp":1779303975557,"segment":12,"confidence":null,"asi":{"baseline":true,"next":"Add mock_mode toggle to provider management UI"}}
{"run":66,"commit":"e9da47e","metric":342,"metrics":{"test_count":342},"status":"keep","description":"342 tests (+8): mock_mode toggle in provider form, Mock badge in provider table, API CRUD tests, HTML validation tests","timestamp":1779304204168,"segment":12,"confidence":null,"asi":{"hypothesis":"Add mock_mode toggle to provider management UI - select dropdown + badge in table + API roundtrip","tests_added":8,"next":"Add model external ID batch edit UI, or provider health clickable links"}}
{"run":67,"commit":"2ecae1c","metric":345,"metrics":{"test_count":345},"status":"keep","description":"345 tests (+11): mock_mode DB storage tests, update tests, provider list tests, HTTP API tests, dashboard HTML tests","timestamp":1779304424278,"segment":12,"confidence":3.6666666666666665,"asi":{"hypothesis":"Add mock_mode integration tests for DB storage and update","tests_added":11,"next":"Add model external ID batch edit UI, or streaming response handling tests"}}
{"run":68,"commit":"fb41d2d","metric":348,"metrics":{"test_count":348},"status":"keep","description":"348 tests (+14): model mapping CRUD/update/delete tests, HTTP API, mock_mode integration tests","timestamp":1779304809135,"segment":12,"confidence":4.666666666666667,"asi":{"hypothesis":"Add model mapping CRUD API tests and HTML validation for mock mode toggle","tests_added":14,"next":"Add more dashboard HTML validation tests for logs table, stats granularity, CSV export"}}
{"run":69,"commit":"d88e5ff","metric":355,"metrics":{"test_count":355},"status":"keep","description":"355 tests (+21): comprehensive dashboard HTML validation tests, mock_mode integration, model mapping CRUD API tests","timestamp":1779304867456,"segment":12,"confidence":7,"asi":{"hypothesis":"Add comprehensive dashboard HTML validation tests for existing features: pagination, time presets, CSV export, batch external ID, model/provider filters, health table, stats time filter","tests_added":21,"next":"One more iteration - add SSE error handling edge case tests, usage extraction tests for different provider formats"}}
{"type":"config","name":"LlmGateway Dashboard Polish Round 11","metricName":"features_complete","metricUnit":"","bestDirection":"higher"}
{"run":70,"commit":"6aa4bb5","metric":355,"metrics":{"test_count":355},"status":"keep","description":"Baseline: 355 tests - document reorganization complete (9 docs → 4, 2740 → ~1500 lines, no redundancy)","timestamp":1779385058000,"segment":13,"confidence":null,"asi":{"hypothesis":"Document reorganization baseline - merged redundant docs, deleted 3 files, restructured to 4 clean docs"}}
{"run":71,"commit":"a50d9c8","metric":380,"metrics":{"test_count":380},"status":"keep","description":"380 tests (+7.0%): 25 new dashboard HTML validation tests for quota window mode/size/step/tz/calibration/period, stats granularity/provider filter, usage trend chart, dark theme colors, responsive layout, stacked token chart, health clickable provider","timestamp":1779385226435,"segment":13,"confidence":null,"asi":{"hypothesis":"Add 25 dashboard HTML validation tests for quota management, stats granularity, request trend, dark theme, responsive design, stacked token chart, health table clickable provider","new_tests":25}}
{"run":72,"commit":"a41dcd7","metric":410,"metrics":{"test_count":410},"status":"keep","description":"410 tests (+15.5%): 30 new dashboard HTML tests for 6 tab navigation, 6 overview stats cards, 7 provider form fields, 3 log management, 2 Chart.js config, 3 API calls, 3 model management","timestamp":1779385347973,"segment":13,"confidence":2.2,"asi":{"hypothesis":"Add 30 more dashboard HTML validation tests for tab navigation, overview stats cards, provider form fields, log management, Chart.js config, API calls, model management","new_tests":30}}
{"run":73,"commit":"e5794ab","metric":440,"metrics":{"test_count":440},"status":"keep","description":"440 tests (+23.9%): 30 more dashboard HTML tests covering API key form (4), provider ops (4), quota ops (2), log search/filter (2), stats table (1), chart color (1), external ID (1), QA/raw mode (2), visual design (2), log indicators (2), table columns (9)","timestamp":1779385458418,"segment":13,"confidence":3.090909090909091,"asi":{"hypothesis":"Add 30 more dashboard HTML tests for API key form, provider operations, quota ops, log search/filter, stats table, chart color, external ID, QA/raw mode, gradient title, modal close, streaming/throttled indicators, table columns","new_tests":30}}
{"run":74,"commit":"d855676","metric":453,"metrics":{"test_count":453},"status":"keep","description":"453 tests (+27.6%): 13 new HTTP API tests for API key update/regenerate, chart color, top-provider, usage-trend, log deletion, quota CRUD+calibration, bucketed stats, stats by api key","timestamp":1779385942016,"segment":13,"confidence":3.2666666666666666,"asi":{"hypothesis":"Add 13 HTTP API tests for API key update/regenerate, chart color, top-provider, usage-trend, log deletion, quota CRUD, calibration, bucketed stats, stats by api key with time filter","new_tests":13,"fix":"regenerate endpoint is POST /api/v1/api-keys/:id not /regenerate, response field is 'key' not 'api_key'"}}
{"type":"config","name":"LlmGateway Extended DB & Utils Test Coverage","metricName":"test_count","metricUnit":"","bestDirection":"higher"}
{"run":75,"commit":"aaf0141","metric":527,"metrics":{"test_count":527},"status":"keep","description":"527 tests (+15.1%): 69 new tests in db_extended_test.rs covering untested DB methods (update_api_key, regenerate_api_key, model CRUD, log deletion, quota usage, provider model management), utils (sha256_hash), and auth helpers (extract_json_path)","timestamp":1779420349808,"segment":14,"confidence":null,"asi":{"hypothesis":"Add 69 new tests covering untested DB methods, utils, and auth helpers","new_tests":69,"areas_covered":["sha256_hash (5 tests)","extract_json_path (12 tests)","update_api_key (6 tests)","regenerate_api_key (3 tests)","update_provider_cookies (1 test)","batch_set_provider_active_status (3 tests)","get_provider_model (2 tests)","update_provider_model_test_status (2 tests)","set_provider_models (1 test)","find_providers_with_model (2 tests)","is_model_allowed_for_provider (1 test)","cleanup_mappings_for_provider_model (1 test)","get_request_log (2 tests)","delete_request_log (2 tests)","delete_request_logs_by_provider (1 test)","delete_request_logs_by_api_key (1 test)","delete_all_request_logs (1 test)","delete_request_logs_filtered (1 test)","get_top_provider_by_usage (2 tests)","model CRUD (8 tests)","model mappings (5 tests)","quota extended (9 tests)","count_provider_requests (2 tests)","get_all_quota_usage (1 test)","get_provider_quota_usage (2 tests)"]}}
{"run":76,"commit":"e3e27d6","metric":562,"metrics":{"test_count":562},"status":"keep","description":"562 tests (+6.6%): 35 new HTTP API tests in http_extended_test.rs covering model CRUD (GET/PUT/DELETE), model mappings (add/list/update/delete), quota operations (delete/calibration), log detail/delete, provider chart-color/refresh-token, api key update/regenerate/deactivate, empty endpoint checks","timestamp":1779421383969,"segment":14,"confidence":null,"asi":{"areas_covered":["model CRUD HTTP (GET/PUT/DELETE/create+get/deactivate)","model mapping HTTP (add/list/update/delete)","quota HTTP (delete/calibration list)","log detail/delete not found","provider chart color/refresh token/update fields","api key update/regenerate/deactivate via PUT/POST","empty endpoint tests (stats/logs/bucketed/health/token-rate/top-provider/usage-trend/stats-by-api-key)","logs batch-delete/delete-all empty"],"fixes":"create_api_key/create_provider return CREATED(201) not OK(200), model get returns ModelWithMappings (data.model.id), model update returns {id,message} not model data, refresh_provider_token succeeds for api_key providers","hypothesis":"Add 35 HTTP API tests for untested endpoints: model CRUD, model mappings, quota operations, log detail/delete, provider chart-color/refresh-token, api key update/regenerate, empty endpoint checks","new_tests":35}}
